{
    "displayName": "NoRisk Verity",
    "description": "Verity's development pack",
    "inheritsFrom": null,
    "excludeMods": null,
    "mods": [
        {
            "id": "fabric-api",
            "displayName": "Fabric API",
            "source": {
                "type": "modrinth",
                "projectId": "P7dR8mSH",
                "projectSlug": "fabric-api"
            },
            "compatibility": {
                "1.21": {
                    "fabric": {
                        "identifier": "0.116.4+1.21.1",
                        "filename": null,
                        "source": null
                    }
                },
                "1.21.1": {
                    "fabric": {
                        "identifier": "0.116.2+1.21.1",
                        "filename": null,
                        "source": null
                    }
                },
                "1.21.4": {
                    "fabric": {
                        "identifier": "0.115.1+1.21.4",
                        "filename": null,
                        "source": null
                    }
                },
                "1.21.5": {
                    "fabric": {
                        "identifier": "0.123.2+1.21.5",
                        "filename": null,
                        "source": null
                    }
                },
                "1.21.7": {
                    "fabric": {
                        "identifier": "0.129.0+1.21.7",
                        "filename": null,
                        "source": null
                    }
                },
                "1.21.8": {
                    "fabric": {
                        "identifier": "0.131.0+1.21.8",
                        "filename": null,
                        "source": null
                    }
                },
                "1.21.10": {
                    "fabric": {
                        "identifier": "0.135.0+1.21.10",
                        "filename": null,
                        "source": null
                    }
                },
                "1.21.11": {
                    "fabric": {
                        "identifier": "0.140.0+1.21.11",
                        "filename": null,
                        "source": null
                    }
                }
            }
        },
        {
            "id": "fabric-language-kotlin",
            "displayName": "Fabric Kotlin",
            "source": {
                "type": "maven",
                "repositoryRef": "fabric",
                "groupId": "net.fabricmc",
                "artifactId": "fabric-language-kotlin"
            },
            "compatibility": {
                "1.21": {
                    "fabric": {
                        "identifier": "1.13.7+kotlin.2.2.21",
                        "filename": null,
                        "source": null
                    }
                },
                "1.21.1": {
                    "fabric": {
                        "identifier": "1.13.7+kotlin.2.2.21",
                        "filename": null,
                        "source": null
                    }
                },
                "1.21.4": {
                    "fabric": {
                        "identifier": "1.13.7+kotlin.2.2.21",
                        "filename": null,
                        "source": null
                    }
                },
                "1.21.5": {
                    "fabric": {
                        "identifier": "1.13.7+kotlin.2.2.21",
                        "filename": null,
                        "source": null
                    }
                },
                "1.21.7": {
                    "fabric": {
                        "identifier": "1.13.7+kotlin.2.2.21",
                        "filename": null,
                        "source": null
                    }
                },
                "1.21.8": {
                    "fabric": {
                        "identifier": "1.13.7+kotlin.2.2.21",
                        "filename": null,
                        "source": null
                    }
                },
                "1.21.10": {
                    "fabric": {
                        "identifier": "1.13.7+kotlin.2.2.21",
                        "filename": null,
                        "source": null
                    }
                },
                "1.21.11": {
                    "fabric": {
                        "identifier": "1.13.7+kotlin.2.2.21",
                        "filename": null,
                        "source": null
                    }
                }
            }
        },
        {
            "id": "sodium",
            "displayName": "Sodium",
            "source": {
                "type": "modrinth",
                "projectId": "AANobbMI",
                "projectSlug": "sodium"
            },
            "compatibility": {
                "1.21": {
                    "fabric": {
                        "identifier": "mc1.21-0.5.11",
                        "filename": null,
                        "source": null
                    }
                },
                "1.21.1": {
                    "fabric": {
                        "identifier": "mc1.21.1-0.6.13-fabric",
                        "filename": null,
                        "source": null
                    }
                },
                "1.21.4": {
                    "fabric": {
                        "identifier": "mc1.21.4-0.6.10-fabric",
                        "filename": null,
                        "source": null
                    }
                },
                "1.21.5": {
                    "fabric": {
                        "identifier": "mc1.21.5-0.6.13-fabric",
                        "filename": null,
                        "source": null
                    }
                },
                "1.21.7": {
                    "fabric": {
                        "identifier": "mc1.21.6-0.6.13-fabric",
                        "filename": null,
                        "source": null
                    }
                },
                "1.21.8": {
                    "fabric": {
                        "identifier": "mc1.21.8-0.7.0-fabric",
                        "filename": null,
                        "source": null
                    }
                },
                "1.21.10": {
                    "fabric": {
                        "identifier": "mc1.21.10-0.7.2-fabric",
                        "filename": null,
                        "source": null
                    }
                },
                "1.21.11": {
                    "fabric": {
                        "identifier": "mc1.21.11-0.8.1-fabric",
                        "filename": null,
                        "source": null
                    }
                }
            }
        },
        {
            "id": "appleskin",
            "displayName": "AppleSkin",
            "source": {
                "type": "modrinth",
                "projectId": "EsAfCjCV",
                "projectSlug": "appleskin"
            },
            "compatibility": {
                "1.21": {
                    "fabric": {
                        "identifier": "3.0.6+mc1.21",
                        "filename": null,
                        "source": null
                    }
                },
                "1.21.1": {
                    "fabric": {
                        "identifier": "3.0.6+mc1.21",
                        "filename": null,
                        "source": null
                    }
                },
                "1.21.4": {
                    "fabric": {
                        "identifier": "cHQjeYVS",
                        "filename": null,
                        "source": null
                    }
                },
                "1.21.5": {
                    "fabric": {
                        "identifier": "VfjnbBAT",
                        "filename": null,
                        "source": null
                    }
                },
                "1.21.7": {
                    "fabric": {
                        "identifier": "3.0.6+mc1.21.6",
                        "filename": null,
                        "source": null
                    }
                },
                "1.21.8": {
                    "fabric": {
                        "identifier": "3.0.6+mc1.21.6",
                        "filename": null,
                        "source": null
                    }
                },
                "1.21.10": {
                    "fabric": {
                        "identifier": "3.0.7+mc1.21.9",
                        "filename": null,
                        "source": null
                    }
                },
                "1.21.11": {
                    "fabric": {
                        "identifier": "pvcLnrm0",
                        "filename": null,
                        "source": null
                    }
                }
            }
        },
        {
            "id": "health-indicators",
            "displayName": "health-indicators",
            "source": {
                "type": "modrinth",
                "projectId": "htkVd6dQ",
                "projectSlug": "health-indicators"
            },
            "compatibility": {
                "1.21": {
                    "fabric": {
                        "identifier": "21.1.3",
                        "filename": null,
                        "source": null
                    }
                },
                "1.21.1": {
                    "fabric": {
                        "identifier": "21.1.3",
                        "filename": null,
                        "source": null
                    }
                },
                "1.21.4": {
                    "fabric": {
                        "identifier": "21.2.2-beta",